{
  "intent_type": "plan",
  "stage": "suggest",
  "bot_message": "我看到大家已经在聊吃饭时间和地点了。要不要我先帮你们把这局收口成一个轻量投票？",
  "npc_messages": [
    {
      "actorId": "akai",
      "text": "我可以，最好别太晚。"
    },
    {
      "actorId": "naicha",
      "text": "地点别太远我就跟。"
    }
  ],
  "function_suggestion": {
    "label": "生成成局投票",
    "task": "intent",
    "reason": "已有活动意图、时间偏好和地点约束。"
  },
  "chips": [
    "帮我收口成投票",
    "匿名问问有没有人想去",
    "有人开始争时间了，先降温"
  ]
}
